{
  "apiVersion": "agentic-sdlc-kit/v1",
  "threadId": "thread-production-regression-01",
  "groundPacketDigest": "d06a41d78cfb3aee061d2f166010d0c6ad55b6237e8e7f8536114dfe6c8f28b4",
  "trackState": "completed",
  "completedWork": [
    "Released the bounded change.",
    "Observed a telemetry warning, recorded regression, and completed rollback.",
    "Created a separate linked follow-up thread for incident learning."
  ],
  "changedPaths": ["checkout/retry-message.ts", "checkout/retry-message.test.ts"],
  "decisions": ["production-regressed-01", "production-rolled-back-01"],
  "claims": [],
  "sourceReferences": [
    {
      "id": "src-deployment-regression-01",
      "uri": "urn:groundtrail-example:production-regression:source:src-deployment-regression-01",
      "digest": "a0dd8b994a5b218634d89bad6ed6c80ed47562a6b17c25187b0856acc3eb812f"
    },
    {
      "id": "src-telemetry-regression-01",
      "uri": "urn:groundtrail-example:production-regression:source:src-telemetry-regression-01",
      "digest": "a3027af7a408dd682a92f9b5b552cc0c84c2536a9edd10c146ccec901ecd87e6"
    },
    {
      "id": "src-rollback-regression-01",
      "uri": "urn:groundtrail-example:production-regression:source:src-rollback-regression-01",
      "digest": "61579677e917c579fa9f966f3f966632b65481e890e9288403eb6df5fa17121e"
    }
  ],
  "outstandingControlPoints": [],
  "knownUnknowns": ["The telemetry sample does not isolate device-specific behavior."],
  "nextSkills": ["incident-learning", "evidence-handoff"],
  "revision": "e51fc24"
}
